"accepted_taxa","original_taxa_Baseflor","Chorology_Baseflor","Inflorescence_Baseflor","Sexuality_Baseflor","Pollination_Baseflor","Fruit.type_Baseflor","Dispersal.mode_Baseflor","Flower.color_Baseflor","Flowering_Baseflor","Growth.form_Baseflor","Habitat_Baseflor"
"Cytisus scoparius","Cytisus scoparius","Européen occidental","Racème simple","Hermaphrodite","Entomogame","Gousse","Autochore","Jaune","4-7","Nanophanérophytaie","Fourrés d'arbrisseaux européens pionniers, acidophiles, mésohydriques à mésoxérophiles"
"Dactylis","Dactylis glomerata_Dactylis glomerata subsp. glomerata_Dactylis glomerata subsp. hackelii_Dactylis glomerata subsp. hispanica_Dactylis glomerata subsp. lobata_Dactylis glomerata subsp. oceanica","Atlantique_Eurasiatique méridional_Européen central_Méditerranéen_Méditerranéen(eury)","Panicule d'épillets","Hermaphrodite","Anémogame","Caryopse","Épizoochore","Vert","4-9","Hémicryptophytaie","Pelouses aérohalines des falaises maritimes méditerranéennes_Pelouses aérohalines fermées, des hauts de falaises maritimes atlantiques mieux protégés, souvent sur des replats_Pelouses basophiles méditerranéennes_Prairies mésohydriques, fauchées, planitiaires à montagnardes_Sous-bois herbacés acidophiles, boréomontagnards à centro-européens, psychrophiles"
"Dactylis glomerata","Dactylis glomerata","Eurasiatique méridional","Panicule d'épillets","Hermaphrodite","Anémogame","Caryopse","Épizoochore","Vert","4-9","Hémicryptophytaie","Prairies mésohydriques, fauchées, planitiaires à montagnardes"
"Dactylis glomerata subsp. glomerata","Dactylis glomerata_Dactylis glomerata subsp. glomerata_Dactylis glomerata subsp. hackelii_Dactylis glomerata subsp. hispanica_Dactylis glomerata subsp. lobata_Dactylis glomerata subsp. oceanica","Atlantique_Eurasiatique méridional_Européen central_Méditerranéen_Méditerranéen(eury)","Panicule d'épillets","Hermaphrodite","Anémogame","Caryopse","Épizoochore","Vert","4-9","Hémicryptophytaie","Pelouses aérohalines des falaises maritimes méditerranéennes_Pelouses aérohalines fermées, des hauts de falaises maritimes atlantiques mieux protégés, souvent sur des replats_Pelouses basophiles méditerranéennes_Prairies mésohydriques, fauchées, planitiaires à montagnardes_Sous-bois herbacés acidophiles, boréomontagnards à centro-européens, psychrophiles"
"Dasypyrum villosum","Dasypyrum villosum","Méditerranéen","Panicule d'épillets","Hermaphrodite","Anémogame","Caryopse","Épizoochore","Vert","5-7","Thérophytaie","Annuelles des tonsures acidophiles, thermophiles, thermoméditerranéennes, maritimes"
"Datura stramonium","Datura stramonium","Cosmopolite","Fleur solitaire terminale","Hermaphrodite","Entomogame","Capsule","Épizoochore","Blanc","7-10","Thérophytaie","Friches annuelles, nitrophiles, thermophiles, euryméditerranéennes"
"Daucus","Daucus carota_Daucus carota subsp. hispidus","Européen_Méditerranéen","Ombelle d'ombellules","Hermaphrodite","Entomogame","Akène","Épizoochore","Blanc","5-10_5-7","Hémicryptophytaie","Friches vivaces mésoxérophiles, médio-européennes_Pelouses aérohalines méditerranéennes, corso-sardes"
"Daucus carota","Daucus carota","Européen","Ombelle d'ombellules","Hermaphrodite","Entomogame","Akène","Épizoochore","Blanc","5-10","Hémicryptophytaie","Friches vivaces mésoxérophiles, médio-européennes"
"Daucus carota subsp. carota","Daucus carota subsp. hispidus","Méditerranéen","Ombelle d'ombellules","Hermaphrodite","Entomogame","Akène","Épizoochore","Blanc","5-7","Hémicryptophytaie","Pelouses aérohalines méditerranéennes, corso-sardes"
"Daucus crinitus",NA,NA,NA,NA,NA,NA,NA,NA,NA,NA,NA
"Delphinium","Delphinium ajacis_Delphinium consolida_Delphinium halteratum_Delphinium pubescens_Delphinium verdunense","Eurasiatique_Méditerranéen_Méditerranéen occidental_Méditerranéen-atlantique","Racème de racèmes","Hermaphrodite","Entomogame","Follicule","Barochore_Épizoochore","Bleu_Bleu, blanc, rose","6-7_6-8_7-8","Thérophytaie","Annuelles commensales des cultures sarclées basophiles, méditerranéennes_Annuelles commensales des moissons basophiles, mésothermes_Annuelles commensales des moissons basophiles, thermophiles_Friches annuelles rudérales, européennes_Friches annuelles, méso-eutrophiles à eutrophiles, méditerranéo-atlantiques, vernales"
"Delphinium ajacis","Delphinium ajacis","Méditerranéen-atlantique","Racème de racèmes","Hermaphrodite","Entomogame","Follicule","Épizoochore","Bleu, blanc, rose","6-7","Thérophytaie","Annuelles commensales des cultures sarclées basophiles, méditerranéennes"
"Delphinium consolida","Delphinium consolida","Eurasiatique","Racème de racèmes","Hermaphrodite","Entomogame","Follicule","Barochore","Bleu","6-8","Thérophytaie","Annuelles commensales des moissons basophiles, mésothermes"
"Delphinium halteratum","Delphinium halteratum","Méditerranéen-atlantique","Racème de racèmes","Hermaphrodite","Entomogame","Follicule","Épizoochore","Bleu","","Thérophytaie","Friches annuelles rudérales, européennes"
"Delphinium hispanicum",NA,NA,NA,NA,NA,NA,NA,NA,NA,NA,NA
"Delphinium pubescens","Delphinium pubescens","Méditerranéen occidental","Racème de racèmes","Hermaphrodite","Entomogame","Follicule","Épizoochore","Bleu","6-7","Thérophytaie","Annuelles commensales des moissons basophiles, thermophiles"
"Delphinium verdunense","Delphinium verdunense","Méditerranéen","Racème de racèmes","Hermaphrodite","Entomogame","Follicule","Épizoochore","Bleu","7-8","Thérophytaie","Friches annuelles, méso-eutrophiles à eutrophiles, méditerranéo-atlantiques, vernales"
"Deschampsia cespitosa","Deschampsia cespitosa","Cosmopolite","Panicule d'épillets","Hermaphrodite","Anémogame","Caryopse","Épizoochore","Vert, bleu","6-8","Hémicryptophytaie","Mégaphorbiaies hygrophiles, planitiaires-collinéennes à montagnardes"
"Descurainia sophia","Descurainia sophia","Cosmopolite","Racème simple","Hermaphrodite","Entomogame","Silique","Barochore","Jaune","4-9","Thérophytaie","Friches annuelles vernales à estivales, médio-européennes, des sols à texture grossière"
"Dianthus","Dianthus armeria_Dianthus carthusianorum_Dianthus carthusianorum subsp. carthusianorum","Européen","Cyme bipare","Hermaphrodite","Entomogame","Capsule","Épizoochore","Rose","6-8_6-9","Hémicryptophytaie","Pelouses arénicoles basophiles, médio-européennes occidentales, mésoxérophiles_Pelouses basophiles médio-européennes occidentales, mésohydriques à mésohygroclines"
"Dianthus armeria","Dianthus armeria","Européen","Cyme bipare","Hermaphrodite","Entomogame","Capsule","Épizoochore","Rose","6-8","Hémicryptophytaie","Pelouses arénicoles basophiles, médio-européennes occidentales, mésoxérophiles"
"Dianthus carthusianorum","Dianthus carthusianorum","Européen","Cyme bipare","Hermaphrodite","Entomogame","Capsule","Épizoochore","Rose","6-9","Hémicryptophytaie","Pelouses basophiles médio-européennes occidentales, mésohydriques à mésohygroclines"
"Dianthus carthusianorum subsp. carthusianorum","Dianthus carthusianorum subsp. carthusianorum","Européen","Cyme bipare","Hermaphrodite","Entomogame","Capsule","Épizoochore","Rose","6-9","Hémicryptophytaie","Pelouses basophiles médio-européennes occidentales, mésohydriques à mésohygroclines"
"Digitalis grandiflora","Digitalis grandiflora","Eurasiatique","Racème simple","Hermaphrodite","Entomogame","Capsule","Épizoochore","Jaune","6-9","Hémicryptophytaie","Mégaphorbiaies subalpines à montagnardes, mésohydriques, méso-oligotrophiles, acidophiles, occidentales"
"Digitalis purpurea","Digitalis purpurea","Méditerranéen-atlantique","Racème simple","Hermaphrodite","Entomogame","Capsule","Épizoochore","Rose","5-9","Hémicryptophytaie","Mégaphorbiaies pionnières de clairières acidophiles planitiaires-collinéennes"
"Digitaria","Digitaria ischaemum_Digitaria sanguinalis","Cosmopolite(thermo)","Ombelle simple d'épis","Hermaphrodite","Anémogame","Caryopse","Barochore","Rose","7-10","Thérophytaie","Annuelles commensales des cultures sarclées acidophiles, mésohydriques, des sols sableux"
"Digitaria ischaemum","Digitaria ischaemum","Cosmopolite(thermo)","Ombelle simple d'épis","Hermaphrodite","Anémogame","Caryopse","Barochore","Rose","7-10","Thérophytaie","Annuelles commensales des cultures sarclées acidophiles, mésohydriques, des sols sableux"
"Digitaria sanguinalis","Digitaria sanguinalis","Cosmopolite(thermo)","Ombelle simple d'épis","Hermaphrodite","Anémogame","Caryopse","Barochore","Rose","7-10","Thérophytaie","Annuelles commensales des cultures sarclées acidophiles, mésohydriques, des sols sableux"
"Dioscorea communis","Dioscorea communis","Méditerranéen-atlantique","Racème simple","Dioïque","Entomogame","Baie","Endozoochore","Vert","3-7","Nanophanérophytaie","Fourrés arbustifs et d'arbrisseaux, planitiaires à collinéens, méridionaux"
"Diplotaxis","Diplotaxis erucoides_Diplotaxis muralis_Diplotaxis tenuifolia_Diplotaxis viminea","Européen méridional_Méditerranéen_Méditerranéen occidental_Méditerranéen-atlantique","Racème simple","Hermaphrodite","Entomogame_Entomogame, autogame","Silique","Anémochore","Blanc_Jaune","4-6_4-9_5-10_5-9","Hémicryptophytaie_Thérophytaie","Annuelles commensales des cultures sarclées basophiles_Annuelles commensales des cultures sarclées basophiles, méditerranéennes_Friches annuelles, nitrophiles, thermophiles, euryméditerranéennes_Friches vivaces rudérales pionnières, mésoxérophiles à mésohydriques, médio-européennes"
"Diplotaxis erucoides","Diplotaxis erucoides","Méditerranéen occidental","Racème simple","Hermaphrodite","Entomogame","Silique","Anémochore","Blanc","4-6","Thérophytaie","Annuelles commensales des cultures sarclées basophiles, méditerranéennes"
"Diplotaxis muralis","Diplotaxis muralis","Méditerranéen-atlantique","Racème simple","Hermaphrodite","Entomogame, autogame","Silique","Anémochore","Jaune","5-10","Thérophytaie","Annuelles commensales des cultures sarclées basophiles"
"Diplotaxis tenuifolia","Diplotaxis tenuifolia","Européen méridional","Racème simple","Hermaphrodite","Entomogame","Silique","Anémochore","Jaune","5-9","Hémicryptophytaie","Friches vivaces rudérales pionnières, mésoxérophiles à mésohydriques, médio-européennes"
"Diplotaxis viminea","Diplotaxis viminea","Méditerranéen","Racème simple","Hermaphrodite","Entomogame","Silique","Anémochore","Jaune","4-9","Thérophytaie","Friches annuelles, nitrophiles, thermophiles, euryméditerranéennes"
"Diplotaxis virgata",NA,NA,NA,NA,NA,NA,NA,NA,NA,NA,NA
"Dipsacus fullonum","Dipsacus fullonum","Européen méridional","Cyme capituliforme","Hermaphrodite","Entomogame, autogame","Akène","Anémochore","Rose","7-9","Hémicryptophytaie","Mégaphorbiaies eutrophisées, planitiaires, médio-européennes plutôt occidentales"
"Dipsacus sativus","Dipsacus sativus","Européen","Cyme capituliforme","Hermaphrodite","Entomogame","Akène","Anémochore","Rose","6-8","Hémicryptophytaie","Friches vivaces xérophiles européennes"
"Dittrichia graveolens","Dittrichia graveolens","Méditerranéen(eury)","Racème de capitules","Hermaphrodite","Entomogame","Akène","Anémochore","Jaune","8-10","Thérophytaie","Annuelles commensales des moissons basophiles, thermophiles"
"Dittrichia viscosa","Dittrichia viscosa","Méditerranéen","Racème de capitules","Hermaphrodite","Entomogame","Akène","Anémochore","Jaune","9-10","Hémicryptophytaie","Friches vivaces mésohydriques, thermophiles, euryméditerranéennes, héliophiles"
"Draba","Draba verna","Eurasiatique","Racème simple","Hermaphrodite","Autogame","Silique","Anémochore","Blanc","2-6","Thérophytaie","Ourlets thérophytiques vernaux, nitrophiles, méridionaux, hémisciaphiles à hémihéliophiles"
"Draba verna","Draba verna","Eurasiatique","Racème simple","Hermaphrodite","Autogame","Silique","Anémochore","Blanc","2-6","Thérophytaie","Ourlets thérophytiques vernaux, nitrophiles, méridionaux, hémisciaphiles à hémihéliophiles"
"Dryopteris filix-mas","Dryopteris filix-mas","Holarctique","","Monoïque","Hydrogame","","Autochore","","6-10","Hémicryptophytaie","Sous-bois herbacés médio-européens, planitiaires à montagnards"
"Dysphania ambrosioides","Dysphania ambrosioides","Introduit (amér. tropicale)","Épi de cymes triflores","Hermaphrodite","Anémogame","Akène","Barochore","Vert","7-11","Thérophytaie","Friches annuelles, nitrophiles, thermophiles, estivales, mésohydriques"
"Dysphania aristata",NA,NA,NA,NA,NA,NA,NA,NA,NA,NA,NA
"Ecballium elaterium","Ecballium elaterium","Méditerranéen(eury)","Cyme unipare hélicoïde","Dioïque","Entomogame","Baie","Autochore","Jaune","5-9","Hémicryptophytaie","Friches vivaces xérophiles européennes"
"Echinaria capitata","Echinaria capitata","Méditerranéen-atlantique","Racème capituliforme","Hermaphrodite","Anémogame","Caryopse","Épizoochore","Vert","5-7","Thérophytaie","Annuelles des tonsures basophiles, aéroxérophiles, thermophiles, mésoméditerranéennes, de l'intérieur des terres"
"Echinochloa","Echinochloa colona_Echinochloa crus-galli","Cosmopolite(thermo)","Panicule d'épillets","Hermaphrodite","Anémogame","Caryopse","Barochore_Épizoochore","Vert, rose","7-10","Thérophytaie","Friches annuelles hygrophiles à hydrophiles, eutrophiles, pionnières, eurasiatiques"
"Echinochloa colona","Echinochloa colona","Cosmopolite(thermo)","Panicule d'épillets","Hermaphrodite","Anémogame","Caryopse","Barochore","Vert, rose","7-10","Thérophytaie","Friches annuelles hygrophiles à hydrophiles, eutrophiles, pionnières, eurasiatiques"
"Echinochloa crus-galli","Echinochloa crus-galli","Cosmopolite(thermo)","Panicule d'épillets","Hermaphrodite","Anémogame","Caryopse","Épizoochore","Vert, rose","7-10","Thérophytaie","Friches annuelles hygrophiles à hydrophiles, eutrophiles, pionnières, eurasiatiques"
"Echinops ritro","Echinops ritro","Européen méridional","Racème de capitules","Hermaphrodite","Entomogame, autogame","Akène","Anémochore","Bleu","7-9","Hémicryptophytaie","Friches vivaces xérophiles à mésoxérophiles, méditerranéennes à euryméditerranéennes"
"Echium","Echium arenarium_Echium asperrimum_Echium plantagineum_Echium vulgare","Européen_Européen méridional_Méditerranéen_Méditerranéen(eury)","Racème de cymes unipares scorpioïdes","Hermaphrodite","Entomogame","Akène","Barochore","Bleu","4-5_5-7","Hémicryptophytaie_Thérophytaie","Annuelles des tonsures acidophiles, thermophiles, thermoméditerranéennes, maritimes_Friches vivaces mésoxérophiles, médio-européennes_Friches vivaces xérophiles à mésoxérophiles, méditerranéennes à euryméditerranéennes_Friches vivaces xérophiles, mésoméditerranéennes occidentales"
"Echium arenarium","Echium arenarium","Méditerranéen","Racème de cymes unipares scorpioïdes","Hermaphrodite","Entomogame","Akène","Barochore","Bleu","4-5","Thérophytaie","Annuelles des tonsures acidophiles, thermophiles, thermoméditerranéennes, maritimes"
"Echium asperrimum","Echium asperrimum","Méditerranéen(eury)","Racème de cymes unipares scorpioïdes","Hermaphrodite","Entomogame","Akène","Barochore","Bleu","","Hémicryptophytaie","Friches vivaces xérophiles à mésoxérophiles, méditerranéennes à euryméditerranéennes"
"Echium plantagineum","Echium plantagineum","Européen méridional","Racème de cymes unipares scorpioïdes","Hermaphrodite","Entomogame","Akène","Barochore","Bleu","5-7","Hémicryptophytaie","Friches vivaces xérophiles, mésoméditerranéennes occidentales"
"Echium vulgare","Echium vulgare","Européen","Racème de cymes unipares scorpioïdes","Hermaphrodite","Entomogame","Akène","Barochore","Bleu","","Hémicryptophytaie","Friches vivaces mésoxérophiles, médio-européennes"
"Elymus caninus","Elymus caninus","Holarctique","Épi d'épillets","Hermaphrodite","Anémogame","Caryopse","Épizoochore","Vert","5-8","Hémicryptophytaie","Ourlets internes et clairières vivaces médio-européennes, eutrophiles, mésohygrophiles"
"Elytrigia","Elytrigia campestris_Elytrigia elongata_Elytrigia intermedia_Elytrigia intermedia subsp. intermedia_Elytrigia juncea_Elytrigia repens","Européen méridional_Holarctique_Méditerranéen_Méditerranéen-atlantique_Méditerranéen(eury)-atlantique(eury)","Épi d'épillets","Hermaphrodite","Anémogame","Caryopse","Barochore_Épizoochore","Vert","5-8_6-7_6-8_6-9","Hémicryptophytaie","Friches vivaces pionnières mésoxérophiles, des substrats argileux_Friches vivaces rudérales pionnières, mésoxérophiles à mésohydriques, médio-européennes_Parvochaméphytaies halophiles supralittorales des zones arides_Végétation vivace des dunes maritimes thermophiles, bordières à mobiles"
"Elytrigia campestris","Elytrigia campestris","Méditerranéen(eury)-atlantique(eury)","Épi d'épillets","Hermaphrodite","Anémogame","Caryopse","Épizoochore","Vert","5-8","Hémicryptophytaie","Friches vivaces rudérales pionnières, mésoxérophiles à mésohydriques, médio-européennes"
"Elytrigia elongata","Elytrigia elongata","Méditerranéen","Épi d'épillets","Hermaphrodite","Anémogame","Caryopse","Épizoochore","Vert","6-7","Hémicryptophytaie","Parvochaméphytaies halophiles supralittorales des zones arides"
"Elytrigia intermedia","Elytrigia intermedia","Européen méridional","Épi d'épillets","Hermaphrodite","Anémogame","Caryopse","Épizoochore","Vert","6-9","Hémicryptophytaie","Friches vivaces pionnières mésoxérophiles, des substrats argileux"
"Elytrigia intermedia subsp. intermedia","Elytrigia intermedia subsp. intermedia","Européen méridional","Épi d'épillets","Hermaphrodite","Anémogame","Caryopse","Épizoochore","Vert","6-9","Hémicryptophytaie","Friches vivaces pionnières mésoxérophiles, des substrats argileux"
"Elytrigia juncea","Elytrigia juncea","Méditerranéen-atlantique","Épi d'épillets","Hermaphrodite","Anémogame","Caryopse","Barochore","Vert","6-8","Hémicryptophytaie","Végétation vivace des dunes maritimes thermophiles, bordières à mobiles"
"Elytrigia repens","Elytrigia repens","Holarctique","Épi d'épillets","Hermaphrodite","Anémogame","Caryopse","Épizoochore","Vert","6-9","Hémicryptophytaie","Friches vivaces rudérales pionnières, mésoxérophiles à mésohydriques, médio-européennes"
"Epilobium","Epilobium ciliatum_Epilobium hirsutum_Epilobium lanceolatum_Epilobium montanum_Epilobium obscurum_Epilobium palustre_Epilobium parviflorum_Epilobium roseum_Epilobium tetragonum_Epilobium tetragonum subsp. lamyi_Epilobium tetragonum subsp. tetragonum","Atlantique(eury)_Circumboréal_Eurasiatique_Européen_Introduit (amér. du nord)","Racème simple","Hermaphrodite","Autogame_Entomogame_Entomogame, autogame","Capsule","Anémochore","Blanc, rose_Rose","6-9_7-9","Hémicryptophytaie","Friches et lisières vivaces médio-européennes, eutrophiles, mésohydriques à mésohygrophiles_Grpts vivaces des éboulis médio-européens, acidophiles, montagnards à subalpins_Hémicryptophytaies des sources laurasiennes_Hémicryptophytaies des sources laurasiennes acidophiles_Mégaphorbiaies eutrophisées, planitiaires, médio-européennes plutôt occidentales_Mégaphorbiaies hygrophiles, planitiaires-collinéennes à montagnardes_Ourlets internes eutrophiles, hémisciaphiles, vernaux_Parvocariçaies et jonçaies des tourbières médio-européennes à boréo-subalpines, acidophiles_Prairies hygrophiles pâturées, mésothermes, basophiles"
"Epilobium ciliatum","Epilobium ciliatum","Introduit (amér. du nord)","Racème simple","Hermaphrodite","Autogame","Capsule","Anémochore","Rose","","Hémicryptophytaie","Friches et lisières vivaces médio-européennes, eutrophiles, mésohydriques à mésohygrophiles"
"Epilobium hirsutum","Epilobium hirsutum","Européen","Racème simple","Hermaphrodite","Entomogame, autogame","Capsule","Anémochore","Rose","6-9","Hémicryptophytaie","Mégaphorbiaies hygrophiles, planitiaires-collinéennes à montagnardes"
"Epilobium lanceolatum","Epilobium lanceolatum","Atlantique(eury)","Racème simple","Hermaphrodite","Entomogame","Capsule","Anémochore","Blanc, rose","6-9","Hémicryptophytaie","Grpts vivaces des éboulis médio-européens, acidophiles, montagnards à subalpins"
"Epilobium montanum","Epilobium montanum","Eurasiatique","Racème simple","Hermaphrodite","Entomogame, autogame","Capsule","Anémochore","Rose","6-9","Hémicryptophytaie","Ourlets internes eutrophiles, hémisciaphiles, vernaux"
"Epilobium obscurum","Epilobium obscurum","Européen","Racème simple","Hermaphrodite","Autogame","Capsule","Anémochore","Rose","7-9","Hémicryptophytaie","Hémicryptophytaies des sources laurasiennes acidophiles"
"Epilobium palustre","Epilobium palustre","Circumboréal","Racème simple","Hermaphrodite","Entomogame, autogame","Capsule","Anémochore","Rose","7-9","Hémicryptophytaie","Parvocariçaies et jonçaies des tourbières médio-européennes à boréo-subalpines, acidophiles"
"Epilobium parviflorum","Epilobium parviflorum","Européen","Racème simple","Hermaphrodite","Entomogame, autogame","Capsule","Anémochore","Rose","6-9","Hémicryptophytaie","Prairies hygrophiles pâturées, mésothermes, basophiles"
"Epilobium roseum","Epilobium roseum","Eurasiatique","Racème simple","Hermaphrodite","Autogame","Capsule","Anémochore","Rose","6-9","Hémicryptophytaie","Hémicryptophytaies des sources laurasiennes"
"Epilobium tetragonum","Epilobium tetragonum","Eurasiatique","Racème simple","Hermaphrodite","Autogame","Capsule","Anémochore","Rose","6-9","Hémicryptophytaie","Mégaphorbiaies eutrophisées, planitiaires, médio-européennes plutôt occidentales"
"Epilobium tetragonum subsp. lamyi","Epilobium tetragonum subsp. lamyi","Européen","Racème simple","Hermaphrodite","Autogame","Capsule","Anémochore","Rose","6-9","Hémicryptophytaie","Ourlets internes eutrophiles, hémisciaphiles, vernaux"
"Epilobium tetragonum subsp. tetragonum","Epilobium tetragonum subsp. tetragonum","Eurasiatique","Racème simple","Hermaphrodite","Autogame","Capsule","Anémochore","Rose","6-9","Hémicryptophytaie","Mégaphorbiaies eutrophisées, planitiaires, médio-européennes plutôt occidentales"
"Epipactis","Epipactis helleborine","Eurasiatique","Racème simple","Hermaphrodite","Entomogame","Capsule","Anémochore","Vert","6-8","Hémicryptophytaie","Ourlets basophiles médio-européens mésohydriques, des clairières"
"Epipactis helleborine","Epipactis helleborine","Eurasiatique","Racème simple","Hermaphrodite","Entomogame","Capsule","Anémochore","Vert","6-8","Hémicryptophytaie","Ourlets basophiles médio-européens mésohydriques, des clairières"
"Equisetum","Equisetum arvense_Equisetum palustre_Equisetum ramosissimum_Equisetum sylvaticum_Equisetum telmateia","Circumboréal_Cosmopolite_Eurasiatique méridional_Holarctique septentrional","","Monoïque","Hydrogame","","Anémochore","","3-5_4-6_5-8_5-9","Hémicryptophytaie","Friches vivaces rudérales pionnières, mésohydriques à mésohygrohiles, médio-européennes_Mégaphorbiaies planitiaires-collinéennes, mésotrophiles, neutrophiles_Parvocariçaies et jonçaies des tourbières médio-européennes à boréo-subalpines, acidophiles_Prairies hygrophiles, médio-européennes, mésothermes_Prairies hygrophiles, thermophiles, mésoméditerranéennes"
"Equisetum arvense","Equisetum arvense","Circumboréal","","Monoïque","Hydrogame","","Anémochore","","3-5","Hémicryptophytaie","Friches vivaces rudérales pionnières, mésohydriques à mésohygrohiles, médio-européennes"
"Equisetum palustre","Equisetum palustre","Holarctique septentrional","","Monoïque","Hydrogame","","Anémochore","","5-9","Hémicryptophytaie","Prairies hygrophiles, médio-européennes, mésothermes"
"Equisetum ramosissimum","Equisetum ramosissimum","Cosmopolite","","Monoïque","Hydrogame","","Anémochore","","5-8","Hémicryptophytaie","Prairies hygrophiles, thermophiles, mésoméditerranéennes"
"Equisetum sylvaticum","Equisetum sylvaticum","Holarctique septentrional","","Monoïque","Hydrogame","","Anémochore","","4-6","Hémicryptophytaie","Parvocariçaies et jonçaies des tourbières médio-européennes à boréo-subalpines, acidophiles"
"Equisetum telmateia","Equisetum telmateia","Eurasiatique méridional","","Monoïque","Hydrogame","","Anémochore","","3-5","Hémicryptophytaie","Mégaphorbiaies planitiaires-collinéennes, mésotrophiles, neutrophiles"
"Eragrostis barrelieri","Eragrostis barrelieri","Méditerranéen","Panicule d'épillets","Hermaphrodite","Anémogame","Caryopse","Barochore","Vert","6-10","Thérophytaie","Annuelles commensales des cultures sarclées basophiles, méditerranéennes"
"Eragrostis cilianensis","Eragrostis cilianensis","Cosmopolite(thermo)","Panicule d'épillets","Hermaphrodite","Anémogame","Caryopse","Anémochore","Vert","6-10","Thérophytaie","Annuelles commensales des cultures sarclées basophiles"
"Eragrostis minor","Eragrostis minor","Circumboréal","Panicule d'épillets","Hermaphrodite","Anémogame","Caryopse","Anémochore","Vert","6-10","Thérophytaie","Annuelles commensales des cultures sarclées basophiles"
"Eragrostis pilosa","Eragrostis pilosa","Cosmopolite(thermo)","Panicule d'épillets","Hermaphrodite","Anémogame","Caryopse","Anémochore","Vert","7-10","Thérophytaie","Annuelles commensales des cultures sarclées basophiles"
